message,color
"It is so very hard to be an on-your-own-take-care-of-yourself-because-there-is-no-one-else-to-do-it-for-you grown up.",
"A computer without COBOL and Fortran is like a piece of chocolate cake without ketchup and mustard.",
"Life may have no meaning, or, even worse, it may have a meaning of which you disapprove.",
"Statisticians do it with 95% confidence.",
"Flirting is the gentle art of making a man feel pleased with himself.",
"What do you have when you have six lawyers buried up to their necks in sand? Not enough sand.",
"Correction does much, but encouragement does more.",